vocab_number,poj,poj_sandhi,taiwanese_hanji,english
1,Cha-hng lí án-chóaⁿ bô lâi?,Cha7-hng lí1 án1-chóaⁿ bô7 lâi?,昨昏你按怎無來?,Why didn't you come yesterday?
1,Lí boeh án-chóaⁿ chò?,Lí1 boeh2 án1-chóaⁿ chò?,你欲按怎做?,How are you going to do that?
1,I kóng án-chóaⁿ?,I7 kóng1 án1-chóaⁿ?,伊講按怎?,What did he say?
2,Che ài kúi bān?,Che ài2 kúi1 bān?,這愛幾萬?,How many tens of thousands (of dollars) does this cost?
2,Che ài chi̍t-bān.,Che ài2 chi̍t3-bān.,這愛一萬.,This costs ten thousand.
2,Che ài bān kúi?,Che ài2 bān3 kúi?,這愛萬幾?,"What amount of money between 10,000 and 20,000 is this?"
2,Che ài cha̍p-saⁿ á-sī cha̍p-sì bān kho·.,Che ài2 cha̍p3-saⁿ á1-sī3 cha̍p3-sì2 bān3 kho·.,這愛十三抑是十四萬箍.,"This costs $130,000 or $140,000."
3,Bîn-á-chài lí boeh khì bô·?,Bîn7-á1-chài lí1 boeh2 khì bô·3?,明仔載你欲去無?,Are you going tomorrow?
4,Chit kù bô ì-sù.,Chit kù bô7 ì2-sù.,這句無意思.,This sentence is meaningless.
4,Lí nā bô khì bô ì-sù.,Lí1 nā3 bô7 khì bô7 ì2-sù.,你若無去無意思.,If you don't go it will be ridiculous.
5,Nā ū būn-tê ài mn̄g Lāu-su.,Nā3 ū3 būn3-tê ài2 mn̄g3 Lāu3-su.,若有問題愛問老師.,If you have any question you should ask the teacher.
5,Chit khò lín ū sím-mih būn-tê bô·?,Chit2 khò lín1 ū3 sím1-mih2 būn3-tê bô·3?,這課恁有啥物問題無?,Do you have any questions about this lesson?
6,I khì toh-ūi lí chai-iáⁿ bô·?,I7 khì2 toh2-ūi lí1 chai7-iáⁿ bô·3?,伊去佗位你知影無?,Do you know where he went?
6,Góa m̄-chai.,Góa1 m̄3-chai.,我毋知.,I don't know.
6,"Góa chai i sèⁿ sím-mih, m̄-kú m̄-chai-iáⁿ i sím-mih miâ.","Góa1 chai7 i7 sèⁿ2 sím1-mih2, m̄3-kú1 m̄3-chai7-iáⁿ i7 sím1-mih2 miâ.","我知伊的姓, 毋過毋知影伊的啥物名.",I know his surname but not his given name.
6,M̄-chai ū lâng boeh khì bô·?,M̄3-chai7 ū3 lâng7 boeh2 khì bô·3?,毋知有人欲去無?,I wonder if anybody is going.
7,"Chit tâi thih-bé ài chi̍t-chheng-jī kho·, ē kùi bē?","Chit tâi7 thih32-bé ài2 chi̍t3-chheng7-jī3 kho·, ē3 kùi bē?","這台鐵馬愛一千二箍, 會貴袂?","This bicycle costs $1,200; is that expensive?"
7,Bē kùi; chīn sio̍k.,Bē3 kùi; chīn3 sio̍k.,袂貴; 真俗.,That's not expensive; it's very cheap.
7,Lí ài kúi chheng?,Lí1 ài2 kúi1 chheng?,你愛幾千?,How many thousand do you want/need?
8,"Chiah-ê chheh hō· lí, lí ài bô·?","Chiah2-ê7 chheh hō·3 lí, lí1 ài bô·3?","這些冊予你, 你愛無?",I'll give these books to you; do you want them?
8,Góa ài chit pún niâ-niâ.,Góa1 ài2 chit2 pún niâ7-niâ.,我愛這本爾爾.,I only want this one.
8,Chiah-ê chîⁿ sī sím-mih-lâng ê?,Chiah2-ê7 chîⁿ sī3 sím1-mih2-lâng ê?,這些錢是啥物人的?,Whose money is this?
9,choán-siaⁿ/choán-im,choán1-siaⁿ/choán1-im,轉聲/轉音,to change the tone (on a Taiwanese word).
9,Tē-it siaⁿ choán tē-chhit siaⁿ.,Tē3-it2 siaⁿ choán1 tē3-chhit2 siaⁿ.,第一聲轉第七聲.,The 1st tone changes to the 7th tone.
10,I ē lâi bô·?,I7 ē3 lâi bô·3?,伊會來無?,Will he/she come?
10,"Bē, i bē lâi.","Bē, i7 bē3 lâi.","袂, 伊袂來.","No, he/she won't come."
11,Lín kúi tiám hā-khò?,Lín1 kúi1 tiám1 hā3-khò?,恁幾點下課?,What time is your class over?
11,Hā-khò lí boeh khì toh-ūi bô·?,Hā3-khò lí1 boeh2 khì2 toh2-ūi bô·3?,下課你欲去佗位無?,Are you going anywhere after class?
12,I tī chit keng ha̍k-hāu teh chò Lāu-su.,I7 tī3 chit2 keng7 ha̍k3-hāu teh2 chò2 Lāu3-su.,伊佇這間學校咧做老師.,He's a teacher at this school.
12,Chit ê ha̍k-hāu ū lōa-chē ha̍k-seng?,Chit2 ê7 ha̍k3-hāu ū3 lōa3-chē3 ha̍k3-seng?,這个學校有偌濟學生?,How many students does this school have?
13,Hiah-ê lâng tī hia teh chhòng-siaⁿh?,Hiah2-ê7 lâng tī3 hia teh2 chhòng2-siaⁿh?,彼些人佇遐咧創啥?,What are those people doing there?
13,Tī toh-á-téng hiah-ê chhiám-á iáu-bōe sé.,Tī3 toh2-á-téng hiah2-ê7 chhiám1-á iáu1-bōe3 sé.,佇桌仔頂彼些攕仔猶未洗.,Those forks on the table haven't been washed yet.
14,Chit jī án-chóaⁿ hoat-im?,Chit2 jī àn2-chóaⁿ1 hoat2-im?,這字按怎發音?,How do you pronounce this character?
14,Góa chím-á khai-sí teh tha̍k Hoat-im.,Góa1 chím1-á khai7-sí1 teh2 tha̍k3 Hoat2-im.,我這馬開始咧讀發音.,I am now beginning the study of pronunciation.
15,Lán chím-á lâi ho̍k-si̍p.,Lán1 chím1-á lâi7 ho̍k3-si̍p.,咱這馬來復習.,Let's review now.
15,Ài ho̍k-si̍p tē-peh khò.,Ài2 ho̍k3-si̍p tē3-peh2 khò.,愛復習第八課.,We must review Ls 8.
16,Chím-á saⁿ-tiám cha̍p hun.,Chím1-á saⁿ7-tiám cha̍p3 hun.,這馬三點十分.,It's 3:10 now.
16,Chit khò góa siá jī-cha̍p hun.,Chit2 khò góa1 siá1 jī3-cha̍p3 hun.,這課我寫二十分.,I wrote this lesson in 20 minutes.
17,Tùi chia khì hia ài lōa-chē hun-cheng?,Tùi2 chia khì2 hia ài2 lōa3-chē3 hun7-cheng?,對遮去遐愛偌濟分鐘?,How many minutes does it take to ride from here to there?
17,Ài sì-cha̍p-gō· hun-cheng.,Ài2 sì2-cha̍p3-gō·3 hun7-cheng.,愛四十五分鐘.,It takes 45 minutes.
18,O·-pang hia ū hún-pit bô·?,O·7-pang hia ū3 hún1-pit bô·3?,烏枋遐有粉筆無?,Is there chalk at the blackboard?
18,Iōng hún-pit siá.,Iōng3 hún1-pit siá.,用粉筆寫.,Write with chalk.
19,Che sī góa ê ì-sù.,Che sī3 góa1 ê7 ì2-sù.,這是我的意思.,This is what I mean.
19,Chit kù ê ì-sù sī sím-mih?,Chit2 kù2 ê7 ì2-sù sī3 sím1-mih2?,這句的意思是啥物?,What's the meaning of this sentence?
20,Hit pún chheh ū kúi ia̍h?,Hit2 pún1 chheh ū3 kúi1 ia̍h?,彼本冊有幾頁?,How many pages are there in that book?
20,Hit pún ū nn̄g-pah-gōa ia̍h.,Hit2 pún ū3 nn̄g3-pah2-gōa3 ia̍h.,彼本有兩百外頁.,It has over 200 pages.
21,"Góa mn̄g lí, lí ìn góa.","Góa1 mn̄g3 lí, lí1 ìn2 góa3.","我問你, 你應我.",I'll ask and you answer.
21,Lí àn-chóaⁿ bô ìn?,Lí1 àn2-chóaⁿ bô7 ìn?,你按怎無應?,Why didn't you answer?
22,Góa iōng-kiâⁿ-ê lâi.,Góa1 iōng3-kiâⁿ-ê7 lâi.,我用行的來.,I came here by walking (not any other way).
22,Ài iōng-siá-ê.,Ài2 iōng3-siá-ê3.,愛用寫的.,You must write it.
23,Tī kàu-sek ū hún-pit bô·?,Tī3 kàu2-sek ū3 hún1-pit bô·3?,佇教室有粉筆無?,Is there chalk in the classroom?
23,Ha̍k-seng tī kàu-sek teh tha̍k-chheh.,Ha̍k3-seng tī3 kàu2-sek teh2 tha̍k3-chheh.,學生佇教室咧讀冊.,The students are in the classroom studying.
24,Kúi tiám boeh khai-sí?,Kúi1 tiám1 boeh2 khai7-sí?,幾點欲開始?,What time do we start?
24,Chím-á khai-sí tha̍k tē-peh khò.,Chím1-á khai7-sí1 tha̍k3 tē3-peh2 khò.,這馬開始讀第八課.,Now we begin Ls 8.
25,Chit khò chin hó-tha̍k.,Chit2 khò chin7 hó1-tha̍k.,這課真好讀.,This lesson is very easy.
25,Chit pún chheh ū kúi khò?,Chit2 pún1 chheh ū3 kúi1 khò?,這本冊有幾課?,How many lessons are there in this book?
26,Nn̄g-pah khòng gō· kho·.,Nn̄g3-pah2 khòng2 gō·3 kho·.,兩百空五箍.,$205.
26,Chi̍t-bān khòng gō·-cha̍p kho·.,Chi̍t3-bān3 khòng2 gō·3-cha̍p3 kho·.,一萬空五十箍.,"$10,050."
26,Chím-á cha̍p-jī-tiám khòng káu hun.,Chím1-á cha̍p3-jī3-tiám khòng2 káu1 hun.,這馬十二點空九分.,It's now 12:09.
27,Góa boeh iōng-kiâⁿ-ê khì.,Góa1 boeh2 iōng3-kiâⁿ-ê7 khì.,我欲行的去.,I'll walk there.
28,Chhiáⁿ lí koh kóng chi̍t pái.,Chhiáⁿ1 lí1 koh2 kóng1 chi̍t3 pái.,請你閣講一擺.,Please say it again.
28,Keng-chio chin sio̍k koh chin hó-chia̍h.,Keng7-chio chin7 sio̍k koh2 chin7 hó1-chia̍h.,弓蕉真俗閣真好食.,Bananas are very cheap and very tasty.
29,Chit kù sī sím-mih ì-sù?,Chit2 kù sī3 sím1-mih2 ì2-sù?,這句是啥物意思?,What does this sentence mean?
29,Chit kù ōe chin ū ì-sù.,Chit2 kù2 ōe chin7 ū3 ì2-sù.,這句是有意思的句.,This is a meaningful sentence.
30,Ē kùi bē?,Ē3 kùi bē?,會貴袂?,Is it expensive?
30,Bē kùi.,Bē3 kùi.,袂貴.,It isn't expensive.
30,I hit niá saⁿ chin kùi.,I7 hit2 niá1 saⁿ chin7 kùi.,伊彼領衫真貴.,His shirt was very expensive.
31,Lán lâi siá-jī.,Lán1 lâi7 siá1-jī.,咱來寫字.,Let's write.
32,Kin-á-ji̍t m̄-bián tha̍k-chheh.,Kin7-á1-ji̍t m̄3-bián1 tha̍k3-chheh.,今仔日毋免讀冊.,No school today.
32,"I boeh khì; lí m̄-bián khì.","I7 boeh2 khì; lí1 m̄3-bián1 khì.","伊欲去; 你毋免去.","He's going; you don't have to go."
33,Lí án-chóaⁿ bô mn̄g góa?,Lí1 án1-chóaⁿ bô7 mn̄g góa7?,你按怎無問我?,Why didn't you ask me?
33,"Nā bē-hiáu, ài mn̄g lâng.","Nā3 bē3-hiáu, ài2 mn̄g lâng7.","若袂曉, 愛問人.","If you don't know, you must ask someone."
34,O·-pang hiah-ê jī lí ē-hiáu bē·?,O·7-pang hiah2-ê7 jī lí1 ē3-hiáu bē·3?,烏枋彼些字你會曉無?,Do you know those characters on the blackboard?
35,Chit ki bān-liân-pit ài kúi pah?,Chit ki7 bān3-liân7-pit ài2 kúi1 pah?,這枝萬年筆愛幾百?,How many hundred (dollars) does a fountain pen cost?
35,Bô kúi pah.,Bô7 kúi1 pah.,無幾百.,Not many hundred.
36,Góa lâi chi̍t pái niâ-niâ.,Góa1 lâi7 chi̍t3 pái niâ7-niâ.,我來一擺爾爾.,I only came once.
36,Chit jī chhiáⁿ lí siá gō· pái.,Chit2 jī chhiáⁿ1 lí1 siá1 gō·3 pái.,這字請你寫五擺.,Please write this character 5 times.
37,Chit jī sī kúi siaⁿ?,Chit2 jī sī3 kúi1 siaⁿ?,這字是幾聲?,What's the tone on this word?
37,He sī sím-mih siaⁿ?,He sī3 sím1-mih2 siaⁿ?,伊是啥物聲?,What is that sound?
38,Lí hit tâi thih-bé ū sio̍k bô·?,Lí1 hit2 tâi7 thih2-bé ū3 sio̍k bô·3?,你彼台鐵馬會俗無?,Was your bicycle cheap?
38,Bô sio̍k; chīn kùi.,Bô7 sio̍k; chīn3 kùi.,無俗; 真貴.,Not cheap; it was very expensive.
39,Kúi tiám siōng-khò?,Kúi1 tiám siōng3-khò?,幾點上課?,What time is class?
39,I chím-á teh siōng-khò.,I7 chím1-á teh2 siōng3-khò.,伊這馬咧上課.,He's in class now.
40,Tē-kúi khò?,Tē3-kúi1 khò?,第幾課?,Which lesson?
40,Tē-it khò.,Tē3-it2 khò.,第一課.,Lesson one.
40,Tē-kúi ia̍h?,Tē3-kúi1 ia̍h?,第幾頁?,Which page?
40,Tē saⁿ-pah gō·-cha̍p-chhit ia̍h.,Tē3 saⁿ7-pah2 gō·3-cha̍p3-chhit2 ia̍h.,第三百五十七頁.,Page 357.
41,Chím-á kúi tiám?,Chím1-á kúi1 tiám?,這馬幾點?,What time is it?
41,saⁿ-tiám-pòaⁿ,saⁿ7-tiám1-pòaⁿ,三點半,3:30.
41,tiám-gōa,tiám1-gōa,點外,It's after one o'clock (and before two).
42,Khiâ thih-bé khì hia ài chi̍t tiám-cheng.,Khiâ7 thih2-bé khì2 hia ài2 chi̍t3 tiám1-cheng.,騎鐵馬去遐愛一點鐘.,It takes an hour to ride a bike there.
42,Lí kin-á-ji̍t boeh tha̍k kúi tiám-cheng?,Lí1 kin7-á1-ji̍t boeh2 tha̍k3 kúi1 tiám1-cheng?,你今仔日欲讀幾點鐘?,How many hours will you study today?
42,Chit tiám-cheng lí ū siōng-khò bô·?,Chit tiám1-cheng lí1 ū3 siōng3-khò bô·3?,這點鐘你有上課無?,Do you have class this period?
43,Lí tòe góa tha̍k.,Lí1 tòe2 góa1 tha̍k.,你綴我讀.,Read this after me.
43,I cha-hng tòe góa khì khòaⁿ tiān-iáⁿ.,I7 cha7-hng tòe2 góa1 khì2 khòaⁿ2 tiān3-iáⁿ.,伊昨昏綴我去看電影.,Yesterday he went with me to a movie.
44,I tùi chia khì hia.,I7 tùi2 chia khì2 hia.,伊對遮去遐.,He went from here to there.
44,I tùi gín-á kóng.,I7 tùi2 gín1-á kóng.,伊對囡仔講.,He told the children.
44,I tùi góa chīn hó.,I7 tùi2 góa1 chīn3 hó.,伊對我真好.,He is good to me.
45,Chit ūi sī sím-mih sian-siⁿ?,Chit2 ūi sī3 sím1-mih2 sian3-siⁿ3?,這位是啥物先生?,Who is this gentleman?
